vllm/model_executor/layers/fused_moe/configs/E=20,N=1536,device_name=AMD_GFX906,dtype=int4_w4a16.json
{
    "1024": {"BLOCK_SIZE_M": 64, "BLOCK_SIZE_N": 64, "BLOCK_SIZE_K": 32,
             "GROUP_SIZE_M": 8, "num_warps": 4, "num_stages": 2},
    "2048": {"BLOCK_SIZE_M": 64, "BLOCK_SIZE_N": 64, "BLOCK_SIZE_K": 32,
             "GROUP_SIZE_M": 8, "num_warps": 4, "num_stages": 2},
    "4096": {"BLOCK_SIZE_M": 64, "BLOCK_SIZE_N": 64, "BLOCK_SIZE_K": 32,
             "GROUP_SIZE_M": 8, "num_warps": 4, "num_stages": 2},
    "8192": {"BLOCK_SIZE_M": 64, "BLOCK_SIZE_N": 64, "BLOCK_SIZE_K": 32,
             "GROUP_SIZE_M": 8, "num_warps": 4, "num_stages": 2}
}