vllm/model_executor/layers/fused_moe/configs/E=256,N=128,device_name=AMD_Radeon_Graphics,dtype=int4_w4a16.json
{
    "1024": {"BLOCK_SIZE_M": 64, "BLOCK_SIZE_N": 128, "BLOCK_SIZE_K": 128, "SPLIT_K": 1,
             "GROUP_SIZE_M": 8, "num_warps": 4, "num_stages": 1},
    "2048": {"BLOCK_SIZE_M": 64, "BLOCK_SIZE_N": 128, "BLOCK_SIZE_K": 128, "SPLIT_K": 1,
             "GROUP_SIZE_M": 8, "num_warps": 4, "num_stages": 1},
    "4096": {"BLOCK_SIZE_M": 64, "BLOCK_SIZE_N": 128, "BLOCK_SIZE_K": 128, "SPLIT_K": 1,
             "GROUP_SIZE_M": 8, "num_warps": 4, "num_stages": 1},
    "8192": {"BLOCK_SIZE_M": 64, "BLOCK_SIZE_N": 128, "BLOCK_SIZE_K": 128, "SPLIT_K": 1,
             "GROUP_SIZE_M": 8, "num_warps": 4, "num_stages": 1}
}